{
  "v": 1,
  "description": "Synthetic public first-origin proof. Original enrollment, configured origin, provider freshness, durable commands and current permissions are not established by this vector.",
  "parameters": {
    "account_id": "00000000-0000-0000-0000-000000000001",
    "device_id": "00000000-0000-0000-0000-000000000002",
    "setup_id": "00000000-0000-0000-0000-000000000003",
    "opening_id": "00000000-0000-0000-0000-000000000004",
    "command_id": "00000000-0000-0000-0000-000000000005",
    "source_pairing_id": "00000000-0000-0000-0000-000000000006",
    "attempt_id": "00000000-0000-0000-0000-000000000007",
    "origin_digest": "OQjjWZy9vkYb80SE9Et1MTw_hxiBSKaluMtYjc-Fk2g",
    "enrolled_point": "BH1ndtPbDNkE3rmTISp71_wFItbgYHFu3-kdxUDybRZlxvIL2KrtZXVGmEto6HdmrJEL6zvGR-hKt-jaKdSqUJs",
    "enrolled_key_id": "y7fj2qoVDsAN8_J8jGPkk1rl6ewamfhlXB4tRB4MElc",
    "canary_point": "BNjvXKlRxLyuI3boETy5zZH4_JxElQ4bRuJK9GSoMYj_U-I3TgPtTVnM07l5sjWmnXiiNq8jXHA5_0RIgGaJ9W4",
    "opening_nonce": "JwxWiiBELNTsg9mWiluT5SW6nsN_jB6QzPhHqCO1--U",
    "attempt_nonce": "w4QoPcaSfgj65EnzfoqPNSNDYaHvGRldgY0-S2kRcgk",
    "issued_ms": "3000000",
    "expires_ms": "3030000",
    "hmac_probe": "j6yoEqvCPPx6l28mrLmZdckeeJYXXJl-6bKv6hr35UY",
    "journal_aes_probe": "-OSkpokncb295Df6YLRkkl_XrzieosWKM512QlPp8abxMNN1ASd4j4zs45E0dfK1CLc6QJSz-iJ4iRXc",
    "withdrawal_aes_probe": "Cx_KgRqBROPBvjydeCSgA7AE81feFNLiypQWxzY2o2L3c73V2MkGeaCZ3qTIV9k3ynJPKuTbUbkpczFI",
    "aes_probe": "-OSkpokncb295Df6YLRkkl_XrzieosWKM512QlPp8abxMNN1ASd4j4zs45E0dfK1CLc6QJSz-iJ4iRXcCx_KgRqBROPBvjydeCSgA7AE81feFNLiypQWxzY2o2L3c73V2MkGeaCZ3qTIV9k3ynJPKuTbUbkpczFI"
  },
  "association": "WlRQQQEBAAAAAAAAAAAAAAAAAAAAAAABAAAAAAAAAAAAAAAAAAAAAgAAAAAAAAAAAAAAAAAAAAMAAAAAAAAAAAAAAAAAAAAEAAAAAAAAAAAAAAAAAAAABQAAAAAAAAAAAAAAAAAAAAY5CONZnL2-RhvzRIT0S3UxPD-HGIFIpqW4y1iNz4WTaMu349qqFQ7ADfPyfIxj5JNa5ensGpn4ZVweLUQeDBJXWYyQ6vcxOrg_7JMGMbmT9kqGV0dbSJ-cR6cw_2v0JAuPrKgSq8I8_HqXbyasuZl1yR54lhdcmX7psq_qGvflRs-d179deO0Dl7hzPpbwV7b1pbm64mtR-z4Ecr96BuRABNjvXKlRxLyuI3boETy5zZH4_JxElQ4bRuJK9GSoMYj_U-I3TgPtTVnM07l5sjWmnXiiNq8jXHA5_0RIgGaJ9W4",
  "core": "WlRQUgEBAAAAAAAAAAAAAAAAAAAAAAABAAAAAAAAAAAAAAAAAAAAAgAAAAAAAAAAAAAAAAAAAAMAAAAAAAAAAAAAAAAAAAAEAAAAAAAAAAAAAAAAAAAABQAAAAAAAAAAAAAAAAAAAAY5CONZnL2-RhvzRIT0S3UxPD-HGIFIpqW4y1iNz4WTaMu349qqFQ7ADfPyfIxj5JNa5ensGpn4ZVweLUQeDBJXWYyQ6vcxOrg_7JMGMbmT9kqGV0dbSJ-cR6cw_2v0JAuPrKgSq8I8_HqXbyasuZl1yR54lhdcmX7psq_qGvflRs-d179deO0Dl7hzPpbwV7b1pbm64mtR-z4Ecr96BuRABNjvXKlRxLyuI3boETy5zZH4_JxElQ4bRuJK9GSoMYj_U-I3TgPtTVnM07l5sjWmnXiiNq8jXHA5_0RIgGaJ9W4AAAAAAAAAAAAAAAAAAAAHAAAAAAAtxsAAAAAAAC478HfJch7Fi2LToEgsip3oG3qw0Vb0eb59qVZPAn5v0iHZ",
  "device_signature": "BKYOSlYveYWvCak-TQU4Ft2mCH6QNFWO2naBpGxWUFFHLacp8L8MJG260bclS_hDY4fLCSZzEY84ma9wmNQ6OA",
  "canary_signature": "HkIdGoTozgLGb7WC4rkN-GXv1Kyk-livC6jgdo3dlKImq8oGeolu2K9f0PJPqLy97_jyexrFK6N1F77k5pSoKA",
  "bundle": "WlRQUgEBAAAAAAAAAAAAAAAAAAAAAAABAAAAAAAAAAAAAAAAAAAAAgAAAAAAAAAAAAAAAAAAAAMAAAAAAAAAAAAAAAAAAAAEAAAAAAAAAAAAAAAAAAAABQAAAAAAAAAAAAAAAAAAAAY5CONZnL2-RhvzRIT0S3UxPD-HGIFIpqW4y1iNz4WTaMu349qqFQ7ADfPyfIxj5JNa5ensGpn4ZVweLUQeDBJXWYyQ6vcxOrg_7JMGMbmT9kqGV0dbSJ-cR6cw_2v0JAuPrKgSq8I8_HqXbyasuZl1yR54lhdcmX7psq_qGvflRs-d179deO0Dl7hzPpbwV7b1pbm64mtR-z4Ecr96BuRABNjvXKlRxLyuI3boETy5zZH4_JxElQ4bRuJK9GSoMYj_U-I3TgPtTVnM07l5sjWmnXiiNq8jXHA5_0RIgGaJ9W4AAAAAAAAAAAAAAAAAAAAHAAAAAAAtxsAAAAAAAC478HfJch7Fi2LToEgsip3oG3qw0Vb0eb59qVZPAn5v0iHZBKYOSlYveYWvCak-TQU4Ft2mCH6QNFWO2naBpGxWUFFHLacp8L8MJG260bclS_hDY4fLCSZzEY84ma9wmNQ6OB5CHRqE6M4Cxm-1guK5Dfhl79SspPpYrwuo4HaN3ZSiJqvKBnqJbtivX9DyT6i8ve_48nsaxSujdRe-5OaUqCg",
  "sha256": {
    "association": "CFzp1V6tkAEp1PM_UxtZuYqrgtFfIKbpNUCfy1AYfDg",
    "core": "poJqf-ov0Vyi18aK85mfqcuBKEEeIvwCsRgGEEWQ6qo",
    "bundle": "qQeEnFuZwGbP916XnKD8uHM5Xll6O0ysEBwQSoGA51Q"
  }
}
